<?xml version="1.0" encoding="utf-8"?>
<warehouses xmlns:xsi="http://www.w3.org/2001/XMLSchema-instance"
    xsi:noNamespaceSchemaLocation="../schemas/schema-4.xsd">
    <warehouse id="ex:Warehouse1">
        <capacity>9</capacity>
        <contact>warehousesupport1@ppcshop.cz</contact>
        <address id="ex:Addr2">
            <country xml:lang="en">Slovakia</country>
            <city xml:lang="en">Nitra</city>
            <streetLine xml:lang="en">Dunajska 14</streetLine>
            <postCode xml:lang="en">49411</postCode>
        </address>
        <product id="ex:Product1">
            <price>50</price>
            <name xml:lang="en">Logitech MX Keys</name>
            <sale>0</sale>
            <VAT>21</VAT>
            <brand id="ex:Brand1">
                <name xml:lang="en">Logitech</name>
                <companyEmail>support@logitech.com</companyEmail>
            </brand>
        </product>
    </warehouse>
    <warehouse id="ex:Warehouse2">
        <capacity>9</capacity>
        <address id="ex:Addr3">
            <country xml:lang="en">Czech republic</country>
            <city xml:lang="en">Praha</city>
            <streetLine xml:lang="en">Za zahradou 2</streetLine>
            <postCode xml:lang="en">16200</postCode>
        </address>
        <product id="ex:Product2">
            <price>100</price>
            <name xml:lang="en">AMD Ryzen 5 7600</name>
            <sale>20</sale>
            <VAT>21</VAT>
            <brand id="ex:Brand2">
                <name xml:lang="en">AMD</name>
                <companyEmail>support@amd.com</companyEmail>
            </brand>
        </product>
    </warehouse>
    <warehouse id="ex:Warehouse3">
        <capacity>9</capacity>
        <contact>dwad@ppcshop.cz</contact>
        <contact>warehousesupport3@ppcshop.cz</contact>
        <address id="ex:Addr3">
            <country xml:lang="en">Czech republic</country>
            <city xml:lang="en">Praha</city>
            <streetLine xml:lang="en">Za zahradou 2</streetLine>
            <postCode xml:lang="en">16200</postCode>
        </address>
        <product id="ex:Product3">
            <price>150</price>
            <name xml:lang="en">AMD Ryzen 7 5700X3D</name>
            <sale>20</sale>
            <VAT>21</VAT>
            <brand id="ex:Brand2">
                <name xml:lang="en">AMD</name>
                <companyEmail>support@amd.com</companyEmail>
            </brand>
        </product>
    </warehouse>
</warehouses>